url,reason,strategy,score,pmid,ref_text,pm_title
https://hinyan1016.hatenablog.com/entry/2025/11/18/062815,linked,B_title_year,0.808,34242915,ESPEN Clinical Nutrition Guidelines - Clinical nutrition in surgery. PubMed - ESPEN guideline: Clini,ESPEN practical guideline: Clinical nutrition in surgery.
https://hinyan1016.hatenablog.com/entry/2026/01/28/111213,no_query,,,,AHA/ASA. 2026 Guideline for the Early Management of Patients With Acute Ischemic Stroke（2018年版および201,
https://hinyan1016.hatenablog.com/entry/2026/01/30/025738,low_score,B2_title_short,0.267,40323557,Interpreting the natural history and pathogenesis of Nipah virus. Lancet Microbe,The Natural History of Acanthamoeba Keratitis: A Systematic Literature Review.
https://hinyan1016.hatenablog.com/entry/2026/01/30/025738,low_score,B2_title_short,0.211,39777153,"Joi P. What is Nipah virus, and why is it spreading again? VaccinesWork (Gavi). ",Nipah virus survey in Pteropus medius of eastern and northeastern region of Indi
https://hinyan1016.hatenablog.com/entry/2026/01/30/025738,low_score,B2_title_short,0.433,30869046,"Choudhury M, et al. Clinical Features of Nipah Virus Encephalitis: A Study from ",Nipah virus infection: A review.
https://hinyan1016.hatenablog.com/entry/2026/01/30/025738,low_score,C_author_year,0.25,32935081,"Choudhury M, et al. Clinical Features of Nipah Virus Encephalitis: A Study from ",The Language of LGBTQ+ Minority Stress Experiences on Social Media.
https://hinyan1016.hatenablog.com/entry/2026/01/30/025738,low_score,B2_title_short,0.211,39777153,"Joi P. What is Nipah virus, and why is it spreading again? VaccinesWork (Gavi). ",Nipah virus survey in Pteropus medius of eastern and northeastern region of Indi
https://hinyan1016.hatenablog.com/entry/2026/01/30/025738,low_score,B_title_year,0.25,41572034,World Health Organization. Disease Outbreak News: Nipah virus infection – Bangla,Expansion by the World Health Organization of the definition of medicinal oxygen
https://hinyan1016.hatenablog.com/entry/2026/01/30/025738,low_score,C_author_year,0.25,40100000,World Health Organization. Disease Outbreak News: Nipah virus infection – Bangla,Dietary modification of membrane composition mimics characteristics of thermal a
https://hinyan1016.hatenablog.com/entry/2026/01/30/025738,low_score,B2_title_short,0.287,29765101,"Arima Y, et al. Nipah Virus Infection in Kozhikode, Kerala, South India, in 2018",Favipiravir (T-705) protects against Nipah virus infection in the hamster model.
https://hinyan1016.hatenablog.com/entry/2026/01/30/025738,low_score,C_author_year,0.25,31193555,"Arima Y, et al. Nipah Virus Infection in Kozhikode, Kerala, South India, in 2018",High Risk Characteristics for Recurrent Cardiovascular Events among Patients wit
https://hinyan1016.hatenablog.com/entry/2026/01/30/025738,low_score,C_author_year,0.25,41945524,"Yadav PD, Sahay RR. Nipah vaccine trials: a milestone in the fight against a dea",Transcatheter Tricuspid Valve Replacement Using Conscious Sedation and Intracard
https://hinyan1016.hatenablog.com/entry/2026/01/30/025738,low_score,B2_title_short,0.267,17698665,"Arankalle VA, Bandyopadhyay BT, Ramdasi AY, et al. Genomic characterization of N",Cis-acting elements in the antigenomic promoter of Nipah virus.
https://hinyan1016.hatenablog.com/entry/2026/01/30/025738,low_score,C_author_year,0.417,17325360,"Arankalle VA, Bandyopadhyay BT, Ramdasi AY, et al. Genomic characterization of N",West Nile virus isolates from India: evidence for a distinct genetic lineage.
https://hinyan1016.hatenablog.com/entry/2026/01/30/025738,low_score,B2_title_short,0.205,39355487,Centers for Disease Control and Prevention (CDC). Nipah virus: Facts for Clinici,Trends and Patterns in Obesity-Related Deaths in the US (2010-2020): A Comprehen
https://hinyan1016.hatenablog.com/entry/2026/01/30/025738,low_score,B_title_year,0.267,31093105,World Health Organization. Nipah virus (Fact sheet). WHO; 30 May 2018.,Cross-sectional study on the utilization of the Pan American Health Organization
https://hinyan1016.hatenablog.com/entry/2026/02/24/083752,low_score,B2_title_short,0.163,23435683,"Edmonds CJ, et al. Dose-response effects of water supplementation on cognitive p",Re-examination of the genotoxic activity of water taken from the Songhua River i
https://hinyan1016.hatenablog.com/entry/2026/02/24/083752,low_score,C_author_year,0.25,24634974,"Edmonds CJ, et al. Dose-response effects of water supplementation on cognitive p",Treating the whole person by integrating care.
https://hinyan1016.hatenablog.com/entry/2025/08/23/192749,low_score,C_author_year,0.25,24645523,"Norton MI, Dunn EW, Aknin LB. Happy Money: The Science of Happier Spending. Simo",Validation of the ANSR Listeria method for detection of Listeria spp. in environ
https://hinyan1016.hatenablog.com/entry/2025/08/23/192749,low_score,B2_title_short,0.177,39845680,Wojno M. Money and Financial Stress Statistics. Bankrate. 2024 Oct 14.,Social determinants of financial stress and association with psychological distr
https://hinyan1016.hatenablog.com/entry/2025/08/23/192749,low_score,C_author_year,0.25,39519055,Wojno M. Money and Financial Stress Statistics. Bankrate. 2024 Oct 14.,Amelanotic Melanoma-Biochemical and Molecular Induction Pathways.
https://hinyan1016.hatenablog.com/entry/2025/08/23/192749,low_score,C_author_year,0.25,23753838,"Caruso C, Rosa R. Sleep and Work. NIOSH Science Blog, CDC. 2012 Mar 8.",Fundus autofluorescence patterns in stargardt disease over time-reply.
https://hinyan1016.hatenablog.com/entry/2025/08/23/192749,low_score,B2_title_short,0.171,31940238,"Kumar A, Killingsworth M, Gilovich T. Spending on Experiences Versus Possessions",The Quality of End-of-Life Care among ICU versus Ward Decedents.
https://hinyan1016.hatenablog.com/entry/2025/08/23/192749,low_score,C_author_year,0.15,36742938,"Kumar A, Killingsworth M, Gilovich T. Spending on Experiences Versus Possessions",Fraser Syndrome: A Stumbling Block for the Anaesthesiologist.
https://hinyan1016.hatenablog.com/entry/2025/08/23/192749,low_score,C_author_year,0.25,29302433,"Mineo L. Good genes are nice, but joy is better. Harvard Gazette. 2017 Apr 11.",A glance at the history of uniportal video-assisted thoracic surgery.
https://hinyan1016.hatenablog.com/entry/2025/08/23/192749,low_score,C_author_year,0.333,26867038,"Whillans AV, Weidman AC, Dunn EW. Valuing Time Over Money Is Associated With Gre",Is spending money on others good for your heart?
https://hinyan1016.hatenablog.com/entry/2025/08/23/192749,low_score,C_author_year,0.25,19936017,Walsh C. Money spent on others can buy happiness. Harvard Gazette. 2008 Apr 17.,An immersed-boundary method for flow-structure interaction in biological systems
https://hinyan1016.hatenablog.com/entry/2025/08/23/192749,low_score,B2_title_short,0.183,39259460,Navia. The Four Pillars of Wealth: Redefining Success. Navia Blog. 2024 Sep 25.,Slowing the Progression of Chronic Kidney Disease in Patients with Type 2 Diabet
https://hinyan1016.hatenablog.com/entry/2025/09/11/103428,low_score,C_author_year,0.306,7895063,"Rowland MJ, et al. J Clin Pharmacol. 1994;34(1):80-5. （セレギリンによる低血糖の症例報告）Hypoglyc",c-fos expression in the rat brain following central administration of neuropepti
https://hinyan1016.hatenablog.com/entry/2025/09/11/103428,low_score,C_author_year,0.438,39685083,"Chmiela T, et al. Mov Disord. 2024;39 Suppl 1: abstr 305. （PD患者の持続血糖モニタリング研究）Epi",Glucose Metabolism Disorders and Parkinson's Disease: Coincidence or Indicator o
https://hinyan1016.hatenablog.com/entry/2025/09/11/103428,low_score,C_author_year,0.15,31452822,"Shi Y, et al. Oncotarget. 2017;8(41):67837-67850. （MPTPマウスにおける体重変化とAM1241の効果）AM1",Ability to Reach Low-Income Smokers Enrolled in a Randomised Controlled Trial Va
https://hinyan1016.hatenablog.com/entry/2025/09/11/103428,low_score,C_author_year,0.25,40964421,"Shih LC, et al. NPJ Parkinsons Dis. 2024;10:28. （PD患者の低体重と腸内細菌叢に関する研究）Unravellin",The Brachyuran Crabs (Crustacea: Decapoda) of Hong Kong: a Historical Review and
https://hinyan1016.hatenablog.com/entry/2025/09/11/103428,low_score,C_author_year,0.15,32863440,"Ma K, et al. Front Aging Neurosci. 2018;10:1. （パーキンソン病患者における体重減少と栄養失調のレビュー）Front",Tracking annual changes of coastal tidal flats in China during 1986-2016 through
https://hinyan1016.hatenablog.com/entry/2026/01/30/030419,linked,B_title_year,1.0,1634895,"Hashimoto S, 他. Transient myoclonic state with asterixis in elderly patients: a new syndrome? J Neur",Transient myoclonic state with asterixis in elderly patients: a new syndrome?
https://hinyan1016.hatenablog.com/entry/2026/02/10/115631,no_query,,,,"加齢・糖尿病とCSFタンパク値に関する文献（Brooks JA, et al. 2019; 各種教科書的記載に基づく）.",
https://hinyan1016.hatenablog.com/entry/2026/02/10/115631,linked,A_author_title,1.0,30765408,"Brooks JA, et al. Causes of albuminocytological dissociation and the impact of age-adjusted cerebros",Causes of albuminocytological dissociation and the impact of age-adjusted cerebrospinal fluid protei
https://hinyan1016.hatenablog.com/entry/2025/09/03/130906,low_score,B2_title_short,0.3,30415756,Medical cannabis use in the Australian community following introduction of legal,Medical cannabis use in older patients: Update on medical knowledge.
https://hinyan1016.hatenablog.com/entry/2025/12/28/085237,linked,A_author_title,1.0,34289086,"Saeki H, et al. Difamilast, a selective phosphodiesterase 4 inhibitor, ointment in paediatric patien","Difamilast, a selective phosphodiesterase 4 inhibitor, ointment in paediatric patients with atopic d"
https://hinyan1016.hatenablog.com/entry/2025/12/28/085237,low_score,C_author_year,0.25,36341215,Otsuka Pharmaceutical Co. Moizerto® Ointment (difamilast) granted approval in Ja,Newer-Generation Drug-Eluting Stents in Patients Undergoing Complex Percutaneous
https://hinyan1016.hatenablog.com/entry/2025/12/28/085237,low_score,B_title_year,0.314,39659052,DermNet NZ. Delgocitinib – Topical JAK inhibitor. Last reviewed Nov 2025.,Benefits of the Topical JAK Inhibitor Delgocitinib in a Patient With Pediatric L
https://hinyan1016.hatenablog.com/entry/2025/12/28/085237,low_score,B2_title_short,0.314,39659052,DermNet NZ. Delgocitinib – Topical JAK inhibitor. Last reviewed Nov 2025.,Benefits of the Topical JAK Inhibitor Delgocitinib in a Patient With Pediatric L
https://hinyan1016.hatenablog.com/entry/2025/12/28/085237,low_score,C_author_year,0.25,41907880,"Lamba R, Paul D. Delgocitinib: A newer Janus kinase inhibitor for dermatologists",New frontiers in oral submucous fibrosis: The promise of collagen based interven
https://hinyan1016.hatenablog.com/entry/2025/08/23/150413,no_query,,,,2022 ESC Guidelines for Ventricular Arrhythmias: Key Points,
https://hinyan1016.hatenablog.com/entry/2025/08/23/150413,low_score,B_title_year,0.207,33594016,"American Heart Association. Adult Tachycardia With a Pulse Algorithm. Dallas, TX",Knowledge on American Heart Association Guidelines Update for Cardiopulmonary Re
https://hinyan1016.hatenablog.com/entry/2025/08/23/150413,no_query,,,,2022 ESC Guidelines for Ventricular Arrhythmias: Key Points,
https://hinyan1016.hatenablog.com/entry/2025/08/23/150413,low_score,B_title_year,0.207,33594016,"American Heart Association. Adult Tachycardia With a Pulse Algorithm. Dallas, TX",Knowledge on American Heart Association Guidelines Update for Cardiopulmonary Re
https://hinyan1016.hatenablog.com/entry/2026/01/13/234631,low_score,B_title_year,0.287,32746531,de Bruijn MAAM. Autoimmune encephalitis and epilepsy（学位論文）. Erasmus University R,"Commentary on ""Autoimmune encephalitis and epilepsy: evolving definition and cli"
https://hinyan1016.hatenablog.com/entry/2026/01/13/234631,low_score,B2_title_short,0.287,32746531,de Bruijn MAAM. Autoimmune encephalitis and epilepsy（学位論文）. Erasmus University R,"Commentary on ""Autoimmune encephalitis and epilepsy: evolving definition and cli"
https://hinyan1016.hatenablog.com/entry/2026/01/13/234631,linked,B_title_year,1.0,33618141,"Ilyas-Feldmann M, et al. Long-term seizure outcome and antiseizure medication use in autoimmune ence",Long-term seizure outcome and antiseizure medication use in autoimmune encephalitis.
https://hinyan1016.hatenablog.com/entry/2026/01/13/234631,low_score,B_title_year,0.35,33029957,"Park S, et al. Autoimmune epilepsy. J Clin Neurol 2020;16(4):519-529.",Clinical Approach to Autoimmune Epilepsy.
https://hinyan1016.hatenablog.com/entry/2026/01/13/234631,low_score,C_author_year,0.15,36210772,"Park S, et al. Autoimmune epilepsy. J Clin Neurol 2020;16(4):519-529.",Enteric Polymer-Coated Porous Silicon Nanoparticles for Site-Specific Oral Deliv
https://hinyan1016.hatenablog.com/entry/2026/01/13/234631,linked,B2_title_short,1.0,30979857,"de Bruijn MAAM, et al. Evaluation of seizure treatment in anti-LGI1, anti-NMDAR, and anti-GABABR enc","Evaluation of seizure treatment in anti-LGI1, anti-NMDAR, and anti-GABA(B)R encephalitis."
https://hinyan1016.hatenablog.com/entry/2025/10/21/104745,linked,B_title_year,1.0,29656433,"Bryant-Smith AC, et al. Antifibrinolytics for heavy menstrual bleeding. Cochrane Database Syst Rev. ",Antifibrinolytics for heavy menstrual bleeding.
https://hinyan1016.hatenablog.com/entry/2025/10/21/104745,linked,A_author_title,1.0,25644784,"Passali GC, et al. Carbazochrome-sodium sulfonate: old drug, new application. J Clin Pharmacol. 2015",An old drug for a new application: carbazochrome-sodium-sulfonate in HHT.
https://hinyan1016.hatenablog.com/entry/2025/10/24/061916,linked,B2_title_short,0.96,39051318,Global Initiative for Asthma (GINA) 2024/2025,Global Initiative for Asthma Guidelines 2024: An Update.
https://hinyan1016.hatenablog.com/entry/2025/11/05/115554,low_score,A_author_title,0.67,8660159,Keane JR. Multiple cranial nerve palsies: analysis of 979 cases. Arch Neurol. 19,Twelfth-nerve palsy. Analysis of 100 cases.
https://hinyan1016.hatenablog.com/entry/2025/11/05/115554,low_score,B2_title_short,0.35,9031122,Keane JR. Multiple cranial nerve palsies: analysis of 979 cases. Arch Neurol. 19,Primary lymphoma of the skull presenting as multiple cranial nerve palsies.
https://hinyan1016.hatenablog.com/entry/2025/11/05/115554,low_score,C_author_year,0.295,9552519,Keane JR. Multiple cranial nerve palsies: analysis of 979 cases. Arch Neurol. 19,Clinical and angiographic outcome of elective stent implantation in small corona
https://hinyan1016.hatenablog.com/entry/2026/01/10/024125,low_score,B_title_year,0.247,34332805,ACC. Consensus on ASCVD Risk Reduction in Hypertriglyceridemia. J Am Coll Cardio,2021 ACC Expert Consensus Decision Pathway on the Management of ASCVD Risk Reduc
https://hinyan1016.hatenablog.com/entry/2026/01/10/024125,low_score,B2_title_short,0.247,34332805,ACC. Consensus on ASCVD Risk Reduction in Hypertriglyceridemia. J Am Coll Cardio,2021 ACC Expert Consensus Decision Pathway on the Management of ASCVD Risk Reduc
https://hinyan1016.hatenablog.com/entry/2026/01/10/024125,linked,A_author_title,1.0,28304224,"Sabatine MS, et al. Evolocumab and Clinical Outcomes in Patients with Cardiovascular Disease (FOURIE",Evolocumab and Clinical Outcomes in Patients with Cardiovascular Disease.
https://hinyan1016.hatenablog.com/entry/2026/01/10/024125,linked,B_title_year,1.0,26039521,"Cannon CP, et al. Ezetimibe Added to Statin Therapy after Acute Coronary Syndromes (IMPROVE-IT). N E",Ezetimibe Added to Statin Therapy after Acute Coronary Syndromes.
https://hinyan1016.hatenablog.com/entry/2026/01/10/024125,low_score,C_author_year,0.25,30701031,"Grundy SM, et al. 2018 AHA/ACC Guideline on the Management of Blood Cholesterol.",Genetic biomarkers predict response to dual BCL-2 and MCL-1 targeting in acute m
https://hinyan1016.hatenablog.com/entry/2026/01/10/024125,low_score,B_title_year,0.138,20709667,ACCORD Study Group. Effects of combination lipid therapy in type 2 diabetes mell,Improved survival for multiple myeloma in denmark based on autologous stem cell 
https://hinyan1016.hatenablog.com/entry/2025/08/07/221658,linked,B_title_year,0.98,37310582,"Ascher JL, Kohli R. Hepatic encephalopathy in children. Indian J Pediatr. 2023;91:280-285",Hepatic Encephalopathy in Children.
https://hinyan1016.hatenablog.com/entry/2025/08/07/221658,linked,B_title_year,0.95,26041962,"Jalan R, Damink SWM, Deutz NEP, et al. Pathogenesis of hepatic encephalopathy: role of ammonia and s",Pathogenesis of hepatic encephalopathy: role of ammonia and systemic inflammation.
https://hinyan1016.hatenablog.com/entry/2025/08/07/221658,linked,B_title_year,1.0,30706420,"Bajaj JS et al. Hepatic Encephalopathy: Definition, Clinical Grading and Diagnostic Principles. J He","Hepatic Encephalopathy: Definition, Clinical Grading and Diagnostic Principles."
https://hinyan1016.hatenablog.com/entry/2025/08/07/221658,low_score,B2_title_short,0.183,38135758,Jahagirdar V. Back to Basics: Decoding Hepatic Encephalopathy. Liver Fellow Netw,Decoding the basis of histological variation in human cancer.
https://hinyan1016.hatenablog.com/entry/2025/08/07/221658,low_score,C_author_year,0.25,40061668,Jahagirdar V. Back to Basics: Decoding Hepatic Encephalopathy. Liver Fellow Netw,Assessment of Expression of Mast Cells Density in Oral Premalignant and Malignan
https://hinyan1016.hatenablog.com/entry/2025/08/07/221658,linked,A_author_title,1.0,28613619,"Mandiga P, Kommu S, Bollu PC. Hepatic Encephalopathy. StatPearls [Internet]. Treasure Island (FL): S",Hepatic Encephalopathy.
https://hinyan1016.hatenablog.com/entry/2025/09/09/073455,linked,A_author_title,1.0,11719745,"Purssell RA, et al. Derivation and validation of a formula to calculate the contribution of ethanol ",Derivation and validation of a formula to calculate the contribution of ethanol to the osmolal gap.
https://hinyan1016.hatenablog.com/entry/2025/09/09/073455,linked,A_author_title,1.0,33457048,Jones AW. Reflections on variability in the blood–breath ratio of ethanol and its importance… 2020（血,Reflections on variability in the blood-breath ratio of ethanol and its importance when evidential b
https://hinyan1016.hatenablog.com/entry/2025/11/30/082846,low_score,B2_title_short,0.225,41375579,"Sato K, et al. Real-world implementation of lecanemab in Japan: Early experience",Early Outcomes of Lecanemab for Alzheimer's Disease in the Veterans Health Admin
https://hinyan1016.hatenablog.com/entry/2025/11/30/082846,low_score,C_author_year,0.25,41947994,"Sato K, et al. Real-world implementation of lecanemab in Japan: Early experience",Identification of QTLs for brown spot resistance in rice.
https://hinyan1016.hatenablog.com/entry/2025/12/04/185834,low_score,B_title_year,0.25,35077466,American Psychiatric Association. Diagnostic and Statistical Manual of Mental Di,Representation of women at American Psychiatric Association annual meetings over
https://hinyan1016.hatenablog.com/entry/2026/01/12/223601,linked,C_author_year,1.0,847061,Bandura A. Self-efficacy: Toward a unifying theory of behavioral change. Psychol Rev. 1977;84(2):191,Self-efficacy: toward a unifying theory of behavioral change.
https://hinyan1016.hatenablog.com/entry/2026/01/12/223601,low_score,C_author_year,0.312,16351326,"Lyubomirsky S, Sheldon KM, Schkade D. Pursuing happiness: The architecture of su",The benefits of frequent positive affect: does happiness lead to success?
https://hinyan1016.hatenablog.com/entry/2026/01/22/085959,low_score,C_author_year,0.25,36169191,"Spinks A, Wasiak J. Scopolamine for preventing and treating motion sickness. Coc",A Coiled Carbon Nanotube Yarn-Integrated Surface Electromyography System To Moni
https://hinyan1016.hatenablog.com/entry/2026/01/22/085959,linked,C_author_year,1.0,36250781,"Karrim Ali, A. et al. Antihistamines for preventing and treating motion sickness. Cochrane Database ",Antihistamines for motion sickness.
https://hinyan1016.hatenablog.com/entry/2026/01/22/085959,low_score,B2_title_short,0.233,34792633,"Reuben, B. et al. Motion sickness diagnostic criteria: Consensus document of the",Altered brain network functional connectivity patterns in patients with vestibul
https://hinyan1016.hatenablog.com/entry/2025/08/14/183023,low_score,A_author_title,0.2,35491432,"Zhou B, et al. Monitoring of disease progression and biomarker discovery in INAD",Phase Ib study of anlotinib combined with TQB2450 in pretreated advanced biliary
https://hinyan1016.hatenablog.com/entry/2025/08/14/183023,low_score,B2_title_short,0.241,36503223,"Zhou B, et al. Monitoring of disease progression and biomarker discovery in INAD",Intra-Individual Variation in Disease-Specific IgG Fc Glycoform Ratios to Monito
https://hinyan1016.hatenablog.com/entry/2025/08/14/183023,low_score,C_author_year,0.292,41555492,"Zhou B, et al. Monitoring of disease progression and biomarker discovery in INAD",Enhancing interpretation of clinical disease-associated copy number variations f
https://hinyan1016.hatenablog.com/entry/2025/08/14/183023,linked,B2_title_short,0.95,37947042,"Kurian MA, et al. Neurodegeneration with brain iron accumulation disorders: the emerging therapeutic",Neurodegeneration with Brain Iron Accumulation Disorders and Retinal Neurovascular Structure.
https://hinyan1016.hatenablog.com/entry/2025/08/14/183023,low_score,B_title_year,0.142,19560787,"Neuroferritinopathy. Gregory A, et al. J Neurol Sci. 2009;284(1-2):134-139 / Rad","Letter to the editor on a paper by Kimura A, Yoshiro H, Yuasa T. Chronic inflamm"
https://hinyan1016.hatenablog.com/entry/2025/08/14/183023,low_score,B2_title_short,0.163,29237931,Hogarth P. New developments in neurodegeneration with brain iron accumulation: e,Tau-mediated Neurodegeneration and Potential Implications in Diagnosis and Treat
https://hinyan1016.hatenablog.com/entry/2025/08/14/183023,low_score,C_author_year,0.25,29276462,Hogarth P. New developments in neurodegeneration with brain iron accumulation: e,Chiropractic Care in the Management of Inactive Ankylosing Spondylitis: A Case S
https://hinyan1016.hatenablog.com/entry/2025/08/14/183023,low_score,A_author_title,0.688,23736975,"Schneider SA, Bhatia KP. Neurodegeneration with brain iron accumulation – clinic","Dystonic opisthotonus: a ""red flag"" for neurodegeneration with brain iron accumu"
https://hinyan1016.hatenablog.com/entry/2025/08/14/183023,linked,B2_title_short,0.95,23447832,"Schneider SA, Bhatia KP. Neurodegeneration with brain iron accumulation – clinical syndromes and the",Neurodegeneration with Brain Iron Accumulation Disorders Overview.
https://hinyan1016.hatenablog.com/entry/2025/10/30/095502,linked,B_title_year,1.0,26086182,Morris MC et al. MIND diet slows cognitive decline with aging. Alzheimer's Dement. 2015.,MIND diet slows cognitive decline with aging.
https://hinyan1016.hatenablog.com/entry/2025/10/30/095502,low_score,B_title_year,0.138,39710175,University of Hawaii News. MIND diet may reduce dementia risk by up to 25%. 2025,Delivering the news of an intraoperative death; literature-based guidance from t
https://hinyan1016.hatenablog.com/entry/2025/10/30/095502,low_score,B2_title_short,0.138,39710175,University of Hawaii News. MIND diet may reduce dementia risk by up to 25%. 2025,Delivering the news of an intraoperative death; literature-based guidance from t
https://hinyan1016.hatenablog.com/entry/2025/12/09/102429,low_score,B_title_year,0.737,34444905,U.S. Pharmacopeia (USP). Safety Review of Gamma-Aminobutyric Acid (GABA). USP Co,United States Pharmacopeia (USP) Safety Review of Gamma-Aminobutyric Acid (GABA)
https://hinyan1016.hatenablog.com/entry/2025/12/09/102429,linked,A_author_title,1.0,19811362,"Shimada M, et al. Anti-hypertensive effect of gamma-aminobutyric acid (GABA)-rich Chlorella on high-",Anti-hypertensive effect of gamma-aminobutyric acid (GABA)-rich Chlorella on high-normal blood press
https://hinyan1016.hatenablog.com/entry/2025/12/21/213230,linked,A_author_title,1.0,32657153,"Mackenzie IRA, et al. TDP-43 pathology in primary lateral sclerosis. Acta Neuropathol. 2020;139(6):1",TDP-43 pathology in primary lateral sclerosis.
https://hinyan1016.hatenablog.com/entry/2025/12/21/213230,low_score,B_title_year,0.4,18808900,"Tartaglia MC, et al. Differentiation between primary lateral sclerosis and amyot",Chapter 15 Juvenile amyotrophic lateral sclerosis.
https://hinyan1016.hatenablog.com/entry/2025/12/21/213230,linked,B2_title_short,1.0,17296839,"Tartaglia MC, et al. Differentiation between primary lateral sclerosis and amyotrophic lateral scler",Differentiation between primary lateral sclerosis and amyotrophic lateral sclerosis: examination of 
https://hinyan1016.hatenablog.com/entry/2025/12/21/213230,linked,A_author_title,0.845,37009451,"Verde F, et al. Serum neurofilament light chain levels in primary lateral sclerosis and upper motor ",Phenotypic correlates of serum neurofilament light chain levels in amyotrophic lateral sclerosis.
https://hinyan1016.hatenablog.com/entry/2025/12/21/213230,linked,A_author_title,1.0,40379483,"Lester DG, et al. Progression and life expectancy in primary lateral sclerosis. J Neurol Neurosurg P",Progression and life expectancy in primary lateral sclerosis.
https://hinyan1016.hatenablog.com/entry/2026/01/06/021814,linked,A_author_title,1.0,33181081,"Mackenzie IS, Ford I, Nuki G, et al. Long-term cardiovascular safety of febuxostat compared with all",Long-term cardiovascular safety of febuxostat compared with allopurinol in patients with gout (FAST)
https://hinyan1016.hatenablog.com/entry/2026/01/06/021814,low_score,A_author_title,0.15,30647505,"White WB, Becker MA, Schechter BM, et al. Cardiovascular safety of febuxostat or",Allopurinol-induced Drug Reactions with Eosinophilia and Systemic Symptoms Syndr
